{
  "schema_version": "1.0",
  "manifest_id": "55555555-5555-4555-8555-555555555555",
  "asset_id": "11111111-1111-4111-8111-111111111111",
  "exact_digest": {
    "algorithm": "sha256",
    "hex": "bbbbbbbbbbbbbbbbbbbbbbbbbbbbbbbbbbbbbbbbbbbbbbbbbbbbbbbbbbbbbbbb",
    "bytes": 12288
  },
  "media_type": "image/webp",
  "dimensions": {
    "width": 320,
    "height": 240
  },
  "variant": {
    "variant_id": "33333333-3333-4333-8333-333333333333",
    "kind": "thumbnail",
    "recipe": "thumbnail-webp-v1"
  },
  "source_application": {
    "id": "cc.memebank.flutter",
    "version": "0.1.0"
  },
  "created_at": "2026-07-31T05:15:00Z",
  "handoff": {
    "handoff_id": "66666666-6666-4666-8666-666666666666",
    "audience": "cc.cliptown.desktop",
    "nonce": "0123456789abcdefghijklmnop",
    "expires_at": "2026-07-31T05:20:00Z",
    "proof": {
      "algorithm": "ed25519",
      "key_id": "device-key-44444444",
      "signature_b64url": "ABCDEFGHIJKLMNOPQRSTUVWXYZabcdefghijklmnopqrstuvwxyz0123456789_-ABCD"
    }
  }
}
